{
  "schema_version": "1.0",
  "description": "Write-Router 内容类型检测数据——快速路由关键词与三类扫描（NSFW三级/战斗四级/言情三级）+ 战争子项（warfare）的命中词表与条件枚举。判定流程（级别顺序/优先级/组合逻辑）保留在 Write-Router SKILL.md 步骤 1.1 与步骤 3，本文件仅提供检测所需数据。",
  "quick_route": {
    "nsfw": ["写床戏", "写NSFW", "写成人", "写色情", "写H", "写情色"],
    "combat": ["写战斗", "写打斗", "写对决", "写打戏", "写单挑", "械斗"],
    "warfare": ["写战争", "写战役", "写战场", "写打仗", "写大战", "写会战", "写攻城", "写两军", "写大军"],
    "romance": ["写感情戏", "写恋爱", "写言情", "写表白", "写暧昧", "写约会", "写心动"]
  },
  "detections": {
    "nsfw": {
      "level1_direct": {
        "keywords": ["阴茎", "阴道", "做爱", "高潮", "精液", "爱液", "操", "干", "小穴", "龟头", "阴蒂", "自慰"],
        "note": "性器官直称/性行为动词/性相关体液词汇——命中即判定；含同义词/代称"
      },
      "level2_scenes": [
        "床戏/亲密接触场景（接吻以上尺度的身体接触描写）",
        "自慰场景（涉及性器官触碰的描写）",
        "性暗示场景（脱衣、抚摸、喘息呻吟等前戏/边缘行为描写）",
        "情色幻想/性幻想（角色脑内明确的情色想象内容）"
      ],
      "level3_contexts": [
        "文本包含连续的性挑逗/性暗示对话（≥3轮）",
        "角色互动以性吸引力为核心驱动力（如勾引、诱惑场景）",
        "用户在上文已明确指示当前章为 NSFW 章节"
      ],
      "not_triggered": [
        "仅出现胸/腿/臀等身体部位词且上下文为正常描写",
        "接吻描写如无进一步身体接触暗示",
        "医学/生理卫生语境下的器官名称"
      ]
    },
    "combat": {
      "level1_direct": {
        "weapon_verbs": ["斩", "刺", "劈", "削", "挑", "扫", "砍", "戳"],
        "hand_verbs": ["拳", "掌", "踢", "踹", "肘击", "膝撞", "摔", "锁"],
        "ability_verbs": ["轰", "炸", "射", "燃", "冻", "电击"],
        "gun_verbs": ["射击", "瞄准", "扣扳机", "换弹"],
        "note": "命中动词且该动作有明确的攻击目标（人）才判定"
      },
      "level2_scenes": [
        "两方或多方对峙后发生肢体/兵器/能力冲突",
        "格挡/闪避/招架 + 反击的往复描写",
        "比试/切磋/决斗场景（即使是点到为止）",
        "追杀/逃亡中的直接对抗（非单纯逃跑）"
      ],
      "level3_contexts": [
        "文本以伤势描写为主，且上下文表明伤势来源于人与人的直接对抗",
        "角色在战斗后的状态评估/战果确认场景"
      ],
      "level4_boundary": [
        "对峙/蓄势描写（拔剑、摆开架势、气息对峙）",
        "战斗后的收剑/离去/沉默"
      ],
      "not_triggered": [
        "单纯的武器描述/兵器鉴赏（无攻击动作和攻击目标）",
        "角色练功/独自修炼（无对手）",
        "体育竞技非格斗类",
        "暗杀/偷袭一击致命（无往复攻防）",
        "魔兽/怪物狩猎（非人与人）"
      ]
    },
    "warfare": {
      "level1_scenes": [
        "军队集结/行军/布阵/调动描写（多单位大规模）",
        "指挥部/军帐/参谋部/沙盘/地图的战场决策场景",
        "攻城/守城/阵地战/会战/战役级冲突",
        "战线/前线/战场全局态势描写",
        "战斗命令传达/军情汇报/战报场景"
      ],
      "note": "warfare 为战争子项检测——命中任一场景即标记 warfare（由 Combat 技能 warfare 组软引导处理，不硬约束）。与 combat 的关系：个体对决（≤5人往复攻防）→ combat 四级扫描；大规模/多场景战争 → warfare。个体对决出现在战争语境中（w06 战中个体时刻）仍按 warfare 处理、战斗细节引用主项技法"
    },
    "romance": {
      "level1_direct": {
        "confession": ["喜欢", "爱", "在一起", "交往"],
        "ambiguous": ["心动", "心跳加速", "脸红", "不敢看", "偷看"],
        "emotion_state": ["暗恋", "吃醋", "在意", "舍不得", "放不下"],
        "note": "命中且发生在角色之间的情感互动语境中才判定"
      },
      "level2_scenes": [
        "具有浪漫含义的肢体接触（牵手、拥抱、靠肩、整理头发/衣领、擦眼泪等）",
        "表白/确认关系的场景（不论结果）",
        "约会场景（吃饭/看电影/逛街/散步/看日出等日常活动，但以情感互动为核心）",
        "争吵后和好/冷战中的情感对峙",
        "思念/触景生情的独处段落（角色的情感指向另一个特定的人）"
      ],
      "level3_contexts": [
        "大段内心独白以对另一个角色的情感为核心内容",
        "角色的行为动机明确由对另一人的情感驱动（如为了让他注意到我、不想让他失望）",
        "回忆与另一个角色的过往互动（且回忆带有情感色彩——怀念/遗憾/甜蜜）"
      ],
      "not_triggered": [
        "日常社交礼仪中的谢谢/不客气/再见等客套用语",
        "纯友谊/兄弟情/战友情（无浪漫暗示）",
        "家人之间的关怀（父母/子女/手足）",
        "NSFW 性场景（由 nsfw 检测优先捕获）",
        "角色对非人类对象的情感（如我爱我的猫）",
        "职业关系层面的欣赏/钦佩/信任（无浪漫暗示）"
      ]
    }
  }
}
